{
  "$schema": "./config.schema.json",
  "algorithm": {
    "matching": "hybrid",
    "useAhoCorasick": true,
    "useBloomFilter": true,
    "useContextAnalysis": true
  },
  "ahoCorasick": {
    "enabled": true,
    "prebuild": true
  },
  "bloomFilter": {
    "enabled": true,
    "expectedItems": 10000,
    "falsePositiveRate": 0.01
  },
  "contextAnalysis": {
    "enabled": true,
    "contextWindow": 50,
    "languages": ["en"],
    "scoreThreshold": 0.5
  },
  "profanityDetection": {
    "enableLeetSpeak": true,
    "caseSensitive": false,
    "strictMode": false,
    "detectPartialWords": false,
    "defaultPlaceholder": "*"
  },
  "evasionProtection": {
    "unicode": true,
    "repeatedCharacters": true,
    "maskedCharacters": true,
    "separatedLetters": true
  },
  "performance": {
    "enableCaching": true,
    "cacheSize": 5000
  },
  "silent": true
}
