{
  "$schema": "./config.schema.json",
  "algorithm": {
    "matching": "aho-corasick",
    "useAhoCorasick": true
  },
  "ahoCorasick": {
    "enabled": true,
    "prebuild": true
  },
  "languages": [
    "english", "hindi", "french", "german", "spanish",
    "bengali", "tamil", "telugu", "brazilian", "greek"
  ],
  "profanityDetection": {
    "enableLeetSpeak": true,
    "caseSensitive": false,
    "strictMode": false,
    "detectPartialWords": false,
    "defaultPlaceholder": "*"
  },
  "evasionProtection": {
    "unicode": true,
    "repeatedCharacters": true,
    "maskedCharacters": true,
    "separatedLetters": true
  },
  "performance": {
    "enableCaching": true,
    "cacheSize": 5000
  },
  "silent": true
}
